title,flair
SpaceX's Starship Flight 7 test flight gets FAA launch license. But when will it fly?,Space
Researchers discover new third class of magnetism that could transform digital devices,Hardware
Here’s what a blockbuster Nissan-Honda merger could mean for the auto industry,Transportation
More than 140 Kenya Facebook moderators sue after diagnoses of severe PTSD,Social Media
Elevated levels of 'forever chemicals' found in several smartwatch wrist bands,Society
Feeling at home? New app lets US homebuyers see neighbors’ politics,Politics
AT&amp;T is dumping hybrid work as it follows Amazon in demanding employees spend 5 days a week in office,Business
"Another major US hospital hacked, data on 1.4 million patients leaked",Security
Threads starts testing scheduled posts,Business
Grubhub pays $25 million for allegedly tricking customers and lying to drivers,Business
TP-Link routers could be banned in the US over national security concerns,Society
Boxing is open to experimentation: Usyk2Fury fight will be monitored by AI referee,Society
This TikTok account pumped out fake war footage with AI — until CBC News investigated,Artificial Intelligence
The Truth About AI: It’s Only As Smart As The Data We Feed It,ADBLOCK WARNING
"ZOTAC confirms GeForce RTX 5090 with 32GB GDDR7 memory, 5080 and 5070 series listed as well",Hardware
"YouTube Sues Gan Jing World, Accusing Video Site of ‘Stealing’ Content to ‘Create a Clone of YouTube.’ The lawsuit alleges the site has been “automatically vacuuming up YouTube user channels and associated content from YouTube.”",Social Media
Russia plans EUV chipmaking tools that it says will be cheaper and easier to build than ASML's — country outlines new roadmap to smaller chips,Hardware
"World’s first Fertilo baby born, eggs mature outside body with stem cell tech | Fertilo offers a faster, safer, and more accessible alternative to conventional IVF, with fewer hormone injections and a reduced treatment cycle.",Biotechnology
"Supreme Court squashes Big Telecom's attempt to avoid New York State's low-income price regulation | Law mandates affordable internet plans for low-income households, capping rates at $15 and $20",Politics
"BBC News: How Facebook restricted news from Palestinian territories
",Social Media
"AT&amp;T Hits Texas Man With $6,000 Bill for Using 3GB of Data",Networking/Telecom
UK consults on proposals to give creative industries and AI developers clarity over copyright laws,Artificial Intelligence
A Third Person Has Received a Transplant of a Genetically Engineered Pig Kidney,Biotechnology
Verizon and Nvidia Unveil AI-Powered Private 5G Network Solution for Enterprises,Artificial Intelligence
"Bridgy Fed, a project to connect the open social web, is now becoming a nonprofit",Software
Biden Set to Announce Chinese Semiconductor Probe: Bloomberg News,Politics
ACLU and Partners Urge Supreme Court to Block TikTok Ban,Social Media
Japanese startup Space One fails to launch rocket for 2nd time,Space
How Facebook restricted news in Palestinian territories,Social Media
A national effort seeks to advance semiconductor research,Hardware
Nissan shares surge 22% after media reports on potential merger with Honda,Business
Trump security advisor urges offensive cyberattacks on China,Security
"Salesforce will hire 2,000 people to sell AI products, CEO Marc Benioff says",Business
"AI poses threat to North American electricity grid, watchdog warns",Energy
"How OpenAI Hopes to Sever Its Nonprofit Roots | As the maker of ChatGPT battles Google and Meta for A.I. supremacy, it’s also fighting to end control by a nonprofit board.",Business
Pornhub will block access for Floridians on Jan. 1,Business
Elon Musk and SpaceX face federal reviews after violations of security reporting rules,Security
Germany’s auto giants were already reeling. Now Trump wants to turn them into American companies,Transportation
The Words That Stop ChatGPT in Its Tracks,Artificial Intelligence
Companies issuing RTO mandates “lose their best talent”: Study,Business
Infosys co-founder repeats calls for a 70-hour work week,Business
Tech executive found guilty for murder of Cash App founder Bob Lee,Business
Amazon commits another $10 billion to Ohio data centers amid questions about energy costs and supply,Hardware
The solar rush: a planet-wide solar boom has been beating expectations at every turn. And it’s only just the beginning.,Energy
NVIDIA Unveils Its Most Affordable Generative AI Supercomputer,Artificial Intelligence
"Microsoft CEO Satya Nadella says ""Google makes more money on Windows than all of Microsoft"" due to its dominance in search and distribution",Artificial Intelligence
Honda and Nissan explore merger to navigate uncertain EV future,Business
"A faster, better way to train general-purpose robots",Robotics/Automation
System76 Releases Updated AMD Ryzen Linux Laptop,Hardware
"DHS Says China, Russia, Iran, and Israel Are Spying on People in US with SS7",Security
Big loss for ISPs as Supreme Court won’t hear challenge to $15 broadband law,Networking/Telecom
"2024 Science.org breakthrough of the year winner and the nine runner ups. 
",Society
FTC’s Lina Khan changes everything with ban on hidden junk fees for things like hotels and concert tickets,Business
"FBI spots HiatusRAT malware attacks targeting web cameras, DVRs",Security
Cash App creator Bob Lee’s killer found guilty of second-degree murder,Software
Election-bound Germany braces for Russian disinformation threat,Society
YouTube Partners With CAA to Protect Artists From Unauthorized AI Use,Artificial Intelligence
“Mind blowing:” Battery cell prices plunge in China’s biggest energy storage auction,Energy
Real estate platform lets residents check neighbors' political affilitations,Software
Elon Musk Xmail Teaser Poses New Threat For Billions Of Gmail Users ,Business
TikTok disinformation falsely accuses von der Leyen of cancelling Romania’s presidential run-off,Society
Artificial intelligence improves mammography-based breast cancer risk prediction,Artificial Intelligence
Seagate launches 32TB Exos M hard drive based on HAMR technology – Mozaic 3+ drives are the world’s first generally available HAMR HDDs,Hardware
"FTC issues rules requiring hotels, ticket sellers to reveal ‘junk fees’",Society
Hundreds of websites to shut down under UK’s ‘chilling’ internet laws ,Net Neutrality
"Dexcom’s over-the-counter glucose monitor now offers users an AI summary of how sleep, meals and more impact sugar levels",Business
The FTC is officially banning hidden junk fees from hotel and ticket prices,Business
China’s AI elite rethink their Silicon Valley dream jobs,Artificial Intelligence
Elon Musk Hints at 'Xmail' : A Potential Rival to Gmail and Apple Mail,Business
"LastPass hacked, users see millions of dollars of funds stolen",Site altered title
"In IT? Need cash? Cybersecurity whistleblowers are earning big payouts, in fraud cases brought by the US government",Business
"Trump FCC chair wants to revoke broadcast licenses—the 1st Amendment might stop him | Brendan Carr backs Trump's war against media, but revoking licenses won't be easy.",Society
Waymo robotaxis are coming to Tokyo in 2025 | TechCrunch,Transportation
EU opens investigation into TikTok over election interference,Society
UK proposes letting tech firms use copyrighted work to train AI,Artificial Intelligence
Amazon facing strike threats as Senate report details hidden widespread injuries,Business
Congo files criminal complaints against Apple in Europe over conflict minerals,Hardware
Google Search could soon let you attach and 'ask anything about a file',Software
"Possible ban on Chinese-made drones dismays U.S. scientists | Switching to costlier, less capable drones could impede research on whales, forests, and more",Politics
Meta fined $263M over 2018 security breach that affected ~3M EU users ,Social Media
Nvidia falls deeper into correction territory as Broadcom rally continues,Business
FBI warns Americans to keep their text messages secure: What to know,Security
Minuscule Robots for Targeted Drug Delivery,Biotechnology
"Scammers use gamified tactics to prey on job seekers, FTC reports $220M in losses | Never pay someone offering you a job - is a good rule of thumb",Society
Tesla is having major issue with its self-driving computer inside new cars,Business
Crucial discontinues the popular MX500 SSD to make way for next-gen drives — SATA III SSD retires after seven years,Hardware
Japan drops mantra of reducing nuclear dependency in new draft plan,Energy
A desert festival where robots are the headliner,Space
Shape-changing device helps people with visual impairment perform location task,Hardware
"‘Burning through cash,’ Boston Dynamics lays off 45 employees",Business
Facebook-parent Meta settles with Australia's privacy watchdog over Cambridge Analytica lawsuit,Social Media
We tested the Nvidia App performance problems — games can run up to 15 percent slower with the app,Software
"Blackmagic’s Vision Pro camera is available for pre-order and costs $30,000",Hardware
China's dual 16-core Hygon CPU server rack barely outperforms a quad-core Skylake Core i7-6700HQ mobile CPU in Geekbench AI,Hardware
Meta AI Proposes Large Concept Models (LCMs): A Semantic Leap Beyond Token-based Language Modeling,Artificial Intelligence
"Waymo to begin testing in Tokyo, its first international destination",Transportation
Israeli spyware maker Paragon bought by US private equity giant | TechCrunch,Privacy
Mark Zuckerberg says Threads has more than 100 million daily active users,Social Media
Lfgss shutting down 16th March 2025 (day before Online Safety Act is enforced),Net Neutrality
"Ingram Micro to 'stop doing business' with Broadcom, downgrade to 'limited engagement' on VMware",Business
Will AI Make Universal Basic Income Inevitable?,ADBLOCK WARNING
Trump meets with TikTok CEO as company asks Supreme Court to block ban on app,Politics
TikTok Files Emergency Appeal With Supreme Court Seeking to Block U.S. Ban,Social Media
KOSA is a bad bill. Rearranging the words won’t change that.,Politics
"Tech Leader, AI Visionary, Endlessly Curious Jensen Huang to Keynote CES 2025",Artificial Intelligence
Tesla tops list of brands with highest fatal accident rate in new study,Transportation
Europe’s Starlink competitor is go; 290 IRIS² satellites by 2030 to provide secure connectivity to governmental users as well as private companies and European citizens.,Networking/Telecom
"Texas AG sues Cali tech companies like Instagram, Reddit, Discord",Social Media
"To Log Into WordPress, You Now Have To Agree Pineapple on Pizza Is Good",Business
"AI outrage: Error-riddled Indigenous language guides do real harm, advocates say",Artificial Intelligence
How AI Can Strengthen Our Democracy,Artificial Intelligence
"Balatro dev swings at PEGI for rating it 18+ because of its 'evil playing cards', jokes that he should 'add microtransactions' like EA Sports FC 25 to 'lower that rating to a 3+' | ""If these other games were rated properly, I'd happily accept the weirdo 18+.""",Software
T-Mobile Invites Users to Beta-Test Cellular Starlink Service,Networking/Telecom
Klarna CEO says the company stopped hiring a year ago because AI 'can already do all of the jobs',Business
Most iPhone owners see little to no value in Apple Intelligence so far,Artificial Intelligence
The Technology That Actually Runs Our World | The most dominant algorithms aren’t the ones choosing what songs Spotify serves you,Software
Snapchat is overhauling how influencers earn money on the platform,Social Media
"UK internet watchdog gives social media companies three months to improve safety or face huge fines. Ofcom can issue fines up to $23 million, or 10 percent of a company's global revenue.",Social Media
Music tells the story of our lives – and trusty old Last.fm does it better than gaudy Spotify Wrapped,Software
Lisa Kudrow says Tom Hanks movie Here is ‘an endorsement for AI’,Artificial Intelligence
Researchers develop ultra-thin film to power wearables using body heat,Biotechnology
Florida to spend up to $15 million on school material review technology for DeSantis laws,Politics
"There are 2,000-plus dead rockets in orbit—here’s a rare view of one | A Japanese company becomes the first to approach a piece of space junk in low-Earth orbit.",Space
"Trillions of tons of underground hydrogen could power Earth for over 1,000 years | Geologic hydrogen could be a low-carbon primary energy resource.",Energy
Hackers Can Jailbreak Digital License Plates to Make Others Pay Their Tolls and Tickets,Security
Russia-linked hackers targeted Polish elections with disinformation blitz: report,Politics
Big Tech Will Scour the Globe in Its Search for Cheap Energy,Energy
"Trump transition team plans sweeping rollback of Biden EV, emissions policies",Transportation
"US needs to do more make cyber attackers pay, Trump adviser says ",Security
Samsung and TSMC locked in intense 2nm chip competition,Business
"Serbian police used Cellebrite to unlock, then plant spyware, on a journalist's phone. | TechCrunch",Security
How Faircado is Revolutionizing Second-Hand Shopping with AI,Business
"Instagram’s head says social media needs more context because of AI | In a series of posts, Adam Mosseri reminds users to consider the source before believing others’ posts.",Social Media
Big Tech's New AI Obsession: Agents That Do Your Work for You | AI agents go beyond chatbots. “This is really the rise of digital labor.”,Artificial Intelligence
AI was used to turn a teen's photo into a nude image. Now the teen is fighting for change to protect other kids.,Artificial Intelligence
The Trouble With Searching Google for ‘the Best’,Business
Two arrested after 'hazardous drone operation' near Boston airport,Robotics/Automation
There's a budget GeForce GPU selling in China that not even Nvidia knew it made — RTX 4010 turns out to be a modified RTX A400 workstation GPU,Hardware
Feds are urged to deploy high-tech drone hunters to solve mystery behind sightings,Robotics/Automation
‘I received a first but it felt tainted and undeserved’: inside the university AI cheating crisis,Artificial Intelligence
"As GoFundMe pulls Luigi Mangione fundraisers, another platform is featuring one on its front page",Social Media
"AI Could Be Making Scientists Less Creative | A new study examining 68 million scientific papers shows using AI boosts researchers' careers, but narrows the questions they ask.",Artificial Intelligence
Dual Intel Arc B580 PC Details Shared — They Will Be Used Alongside An Nvidia Titan Xp For Fast FluidX3D Simulations,Hardware
"Ex-Google CEO warns there's a time to consider ""unplugging"" AI systems",Artificial Intelligence
How the Renewable Energy Boom Is Remaking the American West ,Energy
Automakers Thrived in the Pandemic. Many Are Now Struggling.,Transportation
Researchers have developed a new device which will enable small drones to shoot powerful lasers – something once thought impossible,Robotics/Automation
Man who became famous 20 years ago as the 'Star Wars Kid' says your digital shadow shouldn't define you,Social Media
The fintech company that collapsed and took $90 million of people’s life savings with it,Business
"Rhode Island’s online benefits system shuts down after cyberattack | RIBridges gives access to benefits like Medicare and SNAP, as well as to Rhode Island’s healthcare marketplace website",Security
Google's 'Big Sleep' AI Project uncovers real software vulnerabilities,Artificial Intelligence
Microsoft’s Critical Windows Defender Security Vulnerability,ADBLOCK WARNING
"An Epidemic of Vicious School Brawls, Fueled by Student Cellphones",Society
Automakers Thrived in the Pandemic. Many Are Now Struggling.,Transportation
"Teens abandon X and Facebook as TikTok and WhatsApp gain momentum, report",Social Media
The FBI says your texts aren’t secure. Do you need to stop?,Security
New app lets police identify suspects in the street,Security
The New Jersey Drone Mystery May Not Actually Be That Mysterious,Robotics/Automation
"Snapdragon X Elite laptops have high return rates, claims Intel co-CEO",Hardware
Google TV will just not stop finding new places to show you advertising,Privacy
"Tech billionaires Zuckerberg, Bezos and Altman help bankroll Trump's inauguration. What to know",Politics
Spacecraft makes daring approach of metal object in Earth's orbit | Mashable,Space
1 in 6 Congresswomen Targeted by AI-Generated Sexually Explicit Deepfakes,Privacy
Skechers draw backlash for full-page ad in Vogue that reeks of AI. “You actually didn’t save any money because now I hate you”,Artificial Intelligence
"Shape-Shifting Antenna Takes Cue From ""The Expanse."" Inspired by the sci-fi show, the device morphs to suit its signals",Space
B.C. cities turning to AI to speed up housing approvals,Artificial Intelligence
OpenAI Whistleblower Suchir Balaji’s Death Ruled a Suicide,Artificial Intelligence
"Bitcoin gets almost no support from Microsoft shareholders, as AI data scrutiny tops voting",Business
"Porn viewers wanted ‘demure’ tradwife content this year: Pornhub — ‘Tradwife’ searches up 72 percent, while interest in Mormon content specifically had a big increase this year",Society
Google's NotebookLM now lets you talk to its AI podcast hosts | TechCrunch,Artificial Intelligence
Belgium is constructing the world's first artificial island to harness offshore wind,Energy
Apple may be working on a custom AI server chip with Broadcom's help,Business
Yearlong supply-chain attack targeting security pros steals 390K credentials,Security
How Silicon Valley is disrupting democracy,Politics
US to patch loopholes that allow China to buy banned AI GPUs from other countries — new regulations include national quotas on GPU exports and a global licensing system | U.S. wants to set national quotas on GPU exports.,Politics
SpaceX wants to turn its Texas launch site into a city — ‘all with the goal of making South Texas the Gateway to Mars’: Starbase GM,Space
She didn’t get an apartment because of an AI-generated score – and sued to help others avoid the same fate,Artificial Intelligence
Amazon pauses $1bn Microsoft 365 rollout following Russian security concerns,Business
Cyborg cockroaches can now be mass-produced in a robotic factory. Pleasant dreams | South China Morning Post,Robotics/Automation
"Noninvasive imaging method can penetrate deeper into living tissue. Using high-powered lasers, this new method could help biologists study the body’s immune responses and develop new medicines.",Biotechnology
Meta urges California attorney general to stop OpenAI from becoming for-profit,Business
U.S. and China renew science and technology pact amid growing rivalry,Politics
23andMe must secure its DNA databases immediately,Privacy
US court rejects TikTok request to temporarily halt pending US ban,Privacy
"The optical disc onslaught continues, with LG quitting Blu-ray players",Business
Broadcom says VMware is a better money-making machine than it hoped,Business
AI GPU clusters with one million GPUs are planned for 2027 — Broadcom says three AI supercomputers are in the works,Hardware
OpenAI co-founder Ilya Sutskever believes superintelligent AI will be ‘unpredictable’,Artificial Intelligence
"HDMI 2.2 is set to debut at CES 2025 — the new standard brings higher resolutions, refresh rates, and bandwidth",Hardware
"Looking for love and sex on Tinder, soldiers endanger national security",Security
Controversial EU ad campaign on X broke bloc's own privacy rules,Social Media
Tech companies most threatened by Trump are donating to his inauguration fund,Politics
X gains a faster Grok model and a new 'Grok button',Social Media
"Japanese brewery to make space sake, aims for moon next ",Space
Trump to Dine With Apple’s Tim Cook at Mar-A-Lago Friday (Bloomberg),Politics
"Intel's co-CEO claims retailers say Qualcomm-powered PCs have high return rates, points to new competitors with Arm chips coming in 2025",Hardware
AI’s emissions are about to skyrocket even further,Energy
Nvidia Revives LAN Party After 13 Years To Celebrate RTX 50-Series GPU Launch — GeForce LAN 50 Is A 50-Hour LAN Party Across Four Different Cities,Hardware
OpenAI’s legal battle with Elon Musk reveals internal turmoil over avoiding AI ‘dictatorship’,Business
Biden Administration Is Said to Allow California to Ban New Gas-Powered Cars ,Transportation
Court Denies TikTok's Bid to Pause US Ban Set for Jan. 19,Social Media
OpenAI whistleblower found dead in San Francisco apartment,Artificial Intelligence
AI helps Telegram remove 15 million suspect groups and channels in 2024,Social Media
Police are now using AI to transcribe body-camera videos. Civil rights groups have concerns,Artificial Intelligence
BBC says it has complained to Apple over AI-generated fake news attributed to broadcaster. Notifications from a new Apple product falsely suggested the BBC claimed the New York gunman Luigi Mangione had killed himself,Artificial Intelligence
Blumenthal’s Blatant Hypocrisy: Praising Musk’s ‘Free Speech’ Support for Censorial KOSA Bill,Politics
New device produces critical fertilizer ingredient from thin air,Biotechnology
OpenAI whistleblower found dead in San Francisco apartment,Artificial Intelligence
Pika 2.0 launches to let you upload your characters to AI videos,Artificial Intelligence
OpenAI emails show Elon Musk wanted for-profit structure in 2017,Artificial Intelligence
"OpenAI whistleblower found dead in San Francisco apartment. Suchir Balaji, 26, claimed the company broke copyright law",Artificial Intelligence
"Tech moguls Altman, Bezos and Zuckerberg donate to Trump's inauguration fund",Business
Existing EV batteries may last up to 40% longer than expected,Transportation
Amazon workers authorize strike at company's first-ever unionized warehouse,Business
"UnitedHealth’s Optum left an AI chatbot, used by employees to ask questions about claims, exposed to the internet",Artificial Intelligence
Landmark Law Prohibits Health Insurance Companies from Using AI to Deny Healthcare Coverage,Artificial Intelligence
Naloxone is a highly effective antidote to Canada’s toxic drug crisis. Here’s how it works,Biotechnology
Waymo’s robotaxis pass the first responder test,Robotics/Automation
BBC complains to Apple over misleading shooting headline,Artificial Intelligence
Apple and Google instructed by House committee to prepare to dump TikTok next month,Politics
Microsoft Confirms Password Deletion For 1 Billion Users—Attacks Up 200%,ADBLOCK WARNING
A third of humanity plays video games. This is what it means for the planet.,Energy
"The US military is now talking openly about going on the attack in space | ""We have to build capabilities that provide our leadership offensive and defensive options.""",Space
Tumblr adds Reddit-like ‘communities’,Social Media
X's Last-Minute Update to the Kids Online Safety Act Still Fails to Protect Kids—or Adults—Online,Politics
OpenAI’s Altman will donate $1 million to Trump’s inaugural fund,Politics
Bluesky Hits 25M Users As Exodus From X Continues,Social Media
Don’t use crypto to cheat on taxes: Bitcoin bro gets 2 years,Crypto
"Microsoft Recall is capturing screenshots of sensitive information like credit card and social security numbers | Privacy nightmare is very real, and perfectly avoidable if you disable the feature for good",Privacy
Leading AI Companies Get Lousy Grades on Safety | A new report from the Future of Life Institute gave mostly Ds and Fs,Artificial Intelligence
"Mexico is using an AI-powered app to prevent suicides by detecting small changes in behavior patterns, contributing to a 9% decrease in suicides",Society
"Critical WordPress plugin vulnerability under active exploit threatens thousands | Vulnerability with severity rating of 9.8 out of possible 10 still live on &gt;8,000 sites.",Security
"Unidentified drones spotted over US air base in Germany, report says ",Security
TSMC says first advanced U.S. chip fab 'dang near back' on schedule. Here’s an inside look,Hardware
"We saw a demo of the new AI system powering Anduril’s vision for war • We’re living through the first drone wars, but AI is poised to change the future of warfare even more drastically.
",Artificial Intelligence
"China’s sci-fi spherical Death Star-like robot cop uses AI, facial recognition to track criminals",Robotics/Automation
Training machines to mimic humans,Artificial Intelligence
Turkey fines Google $75 million for violating competition law.,Business
"For kids with rare genetic disorders, customized CRISPR treatments offer hope",Biotechnology
The Government’s Disturbing Rationale for Banning TikTok. Vague national-security concerns don’t justify shutting down the popular Chinese-owned app.,Social Media
"Fish-Inspired Sensor ""Touches"" Using Electric Fields",Biotechnology
AI Agents with More Autonomy Than Chatbots Are Coming. Some Safety Experts Are Worried,Artificial Intelligence
Trump transition wants to scrap crash reporting requirement opposed by Tesla,Transportation
Two nanometre CMOS technology ,Nanotech/Materials
"Generating power with a thin, flexible thermoelectric film | Device could be integrated into clothing, harvest body heat to power gadgets.",Nanotech/Materials
The Witcher 4 trailer debuts: rendered on Nvidia RTX 5000-series GPU and Unreal Engine 5 | This was a surprise,Hardware
The strange logic behind NYC’s push to force license plates on electric bicycles,Society
TSMC Lifts the Curtain on Nanosheet Transistors,Hardware
"Quantum entanglement, not oil or coal, powers new kind of engine",Energy
Discovery of New Cyclic Lipodepsipeptide Orfamide N via Partnership with Middle School Students from the Boys and Girls Club ,Biotechnology
