title,flair
"Gordon Mah Ung, PCWorld editor and renowned hardware journalist, dies at 58",Hardware
Exposed: Engineers ‘locked in factory’ to finish ‘unsafe’ electric car,Business
Russia mulls blocking WhatsApp in 2025,Politics
Your Next Laptop Might Be Thinner and Quieter Thanks to This Fanless Cooler,Hardware
38th Chaos Communication Congress Infos,Society
Interview with Microchess creator Peter Jennings,Software
Chinese workers found in ‘slavery-like conditions’ at BYD construction site in Brazil,Business
How Google Maps Makes It Harder for Palestinians to Navigate the West Bank,Transportation
Mastodon Annual Report 2023,Social Media
AI Agents Will Be Manipulation Engines | Surrendering to algorithmic agents risks putting us under their influence.,Artificial Intelligence
"Google to court: we’ll change our Apple deal, but please let us keep Chrome.",Business
People keep falling for fake 'drones over Jersey' videos | It's never been easier to make AI-generated spoofs.,Artificial Intelligence
Walmart sued over illegally opening bank accounts for delivery drivers.,Transportation
Mighty radio bursts linked to massive galaxies,Space
Roblox gaming site banning preteens from social media options after complaints they lead to child abuse including pedophilia.,Social Media
WhatsApp wins legal victory against NSO Group in Pegasus hacking case — Judge finds no merit in arguments made by Israeli spyware manufacturer,Security
US Launches Probe Into Chinese Semiconductor Industry,Hardware
Retro gamers save one of the last 45-inch CRT TVs in existence. 440-pound 1980s behemoth rescued from an Osaka restaurant days before demolition.,Hardware
"Microsoft works to add non-OpenAI models into 365 Copilot products, sources say",Artificial Intelligence
"PayPal Honey has been caught poaching affiliate revenue, and it often hides the best deals from users | Promoted by influencers, this popular browser extension has been a scam all along",Software
Google Search Changes Are Killing Websites in an Age of AI Spam,Software
Consumer protection board sues Walmart and fintech firm over gig-worker driver pay access,Business
YouTube’s Anorexia Algorithm ,Society
OpenAI Gives Plus Users Unlimited Access to Sora Over the Holidays,Artificial Intelligence
Many Americans have come to rely on Chinese-made drones. Now lawmakers want to ban them,Hardware
"China refused investigation into ship linked to severed Baltic cables, says Sweden",Networking/Telecom
Apple on the Brink: Approaching a Historic $4 Trillion Valuation Amid AI Momentum,Business
"U.S. gov't launches probe into ongoing China dominance of legacy semiconductor market amid concerns of Chinese vendors flooding the market | Legacy chips are manufactured using older, less advanced production processes",Politics
Boy 'Fighting for His Life' After Being Injured as Drones Fell from the Sky During Florida Holiday Show,Society
5 biggest Linux and open-source stories of 2024: From AI arguments to security close calls,Software
Netflix Boss Ted Sarandos Bends the Knee to Trump With Mar-a-Lago Visit,Politics
Government to Name ‘Key Witness’ Who Provided FBI With Backdoored Encrypted Chat App Anom,Security
"Report: Apple's App Store Hosting Hundreds of Inappropriate Apps Rated Safe for Children. Children under twelve can freely download weight loss and fasting trackers and AI girlfriend apps on the App Store, the report claims.",Software
"Social media firings, anti-union contracts, and corporate surveillance: are employers our biggest threat to free speech?",Society
Nissan and Honda start merger talks to take on Tesla and create the world's 3rd largest car company,Business
CERN's Large Hadron Collider finds the heaviest antimatter particle yet,Space
Misinformation and online threats after US CEO slaying ,Society
Discord sued by users claiming Nitro subscription is too difficult to cancel,Social Media
"Engineers achieve quantum teleportation over active internet cables | ""This is incredibly exciting because nobody thought it was possible""",Networking/Telecom
North Korean Lazarus hackers are targeting nuclear workers | Two workers in the same company targeted in a timespan of less than a month,Security
Fining Big Tech isn't working. Make them give away illegally trained LLMs as public domain,Artificial Intelligence
Biological computers could use far less energy than current technology,Biotechnology
The New Climate Gold Rush: Scrubbing Carbon From the Sky,Business
"Inappropriate apps rated as safe for young children are prevalent in the App Store, report warns | In a 24-hour review period, child safety groups found over 200 “risky” apps rated as appropriate for kids 12 and under.",Software
"Mossad spent over a decade orchestrating walkie-talkie plot against Hezbollah — while weaponized pagers, developed in 2022, were promoted with fake ads on YouTube",Security
"Samsung, Amkor, and TI finalize CHIPS deals: 2nm and advanced packaging coming to U.S.",Business
X raises Premium Plus subscription pricing by almost 40 percent,Social Media
"Honda, Nissan inform Japan gov't of planned merger talks",Transportation
"X jacks up Premium+ prices 37.5%, hits some markets harder",Social Media
Breakthrough Brings Body-Heat Powered Wearable Devices Closer to Reality,Hardware
'United Healthcare' Using DMCA Against Luigi Mangione Images Which Is Bizarre &amp; Wildly Inappropriate ,Business
"Holding back China's chipmaking progress is a fool’s errand, says U.S. Commerce Secretary",Hardware
US shoots down two of its own navy pilots over Red Sea in ‘apparent friendly fire’ incident,Politics
"The Race to Translate Animal Sounds Into Human Language | With big cash prizes at stake—and AI supercharging research—interspecies translation is closer than ever. But what, if anything, would animals want to tell us?",Machine Learning
Teens using VPN to cheat in Gorilla Tag are unknowingly selling their internet connections | Cheaters become unwitting accomplices to hackers,Security
Russian cosmonauts install new X-ray detector during ISS spacewalk,Space
Trump muses about keeping TikTok “around for a little while”,Social Media
OpenAI trained o1 and o3 to 'think' about its safety policy,Artificial Intelligence
Tetsuwan Scientific is making robotic AI scientists that can run experiments on their own,Artificial Intelligence
Palantir and Anduril join forces with tech groups to bid for Pentagon contracts — Consortium likely to include SpaceX in move to grab a bigger slice of $850bn US defence budget,Security
Study finds 75% of Facebook shares are made without reading the content,Social Media
All of Canoo’s employees are reportedly on a ‘mandatory unpaid break’,Business
Chinese ship may have tried to sabotage undersea cables before,Networking/Telecom
2024 Open Source Software Funding Report,Software
"Before BYD Taps into S.Korea in January, S.Korean Official Says Anti-subsidy Probe on Chinese EVs Likely ",Politics
Japan to order Google to stop violating antitrust law: sources,Business
Engineers enable quantum communication over existing fiber optic cables — new research shows data transmission using quantum teleportation is possible in parallel with a classical network at specific wavelengths | And it does not violate the laws of physics.,Networking/Telecom
"Albania to ban TikTok for one year, blaming it for inciting youth violence and bullying ",Social Media
Zelle and major banks face $870 million lawsuit over alleged fraud losses | Lawsuit comes after lawmakers began pressuring Zelle to start refunding fraud victims last year,Business
It's AI Versus the World's Largest Tuberculosis Epidemic. An Indian group has built tools to help with diagnosis and treatment,Artificial Intelligence
Tesla's staggering rally - and why it might not last,Business
Apple is working on a doorbell camera with Face ID,Security
"""Copper’s Time Has Run Out"": Nvidia, AMD And TSMC Have Invested Millions In A Startup Which May Hold The Key To Faster Chip Connectivity To Quench AI's Thirst For Bytes",Hardware
Ukraine’s First All-Robot Assault Force Just Won Its First Battle,ADBLOCK WARNING
Climate tech startup aims to store carbon in oceans and reshape the energy sector,Energy
"Apple must ensure interoperability of iPhone with rivals, says European Commission",Software
Italy fines OpenAI 15 million euros over privacy rules breach,Artificial Intelligence
Google’s counteroffer to the government trying to break it up is unbundling Android apps,Business
Arm will seek a new trial against Qualcomm,Business
"TikTok’s annual carbon footprint is likely bigger than Greece’s, study finds",Energy
ChatGPT preferred over in-person lessons as language learning method among young Japanese ,Artificial Intelligence
Saudi Arabia Taps Aramco Oil Field Brine in Lithium Battery Push.,Energy
OpenAI whistleblower who died was being considered as witness against company,Artificial Intelligence
Charmast Power Banks Recalled Due to Fire and Burn Hazards; Sold by Charmast Exclusively on Amazon.com,Hardware
Google asks federal judge to take ‘caution’ while crafting monopoly remedy,Business
"AirPods sales totaled over $18 billion last year, more than all of Nintendo | Earbuds likely to become Apple's 3rd biggest product behind iPhone and Mac",Business
"US senators call out execs at Ford, GM, Tesla et al. for opposing right to repair — The bipartisan group says automakers are hypocrites motivated by profits and not privacy protection",Transportation
"UK arts and media reject plan to let AI firms use copyrighted material | Coalition of musicians, photographers and newspapers insist existing copyright laws must be respected",Society
CQ Roll Call staffers file NLRB complaint over return-to-office mandate,Business
Amazon delays return-to-office mandate for thousands of workers due to space,Business
"‘Yes, I am a human’: bot detection is no longer working – and just wait until AI agents come along",Artificial Intelligence
Albania bans TikTok for a year after killing of teenager,Social Media
"But his emails? Team Trump’s private emails spark concerns – Eight years after targeting Hillary Clinton's email protocols, Trump's transition team is relying on private servers instead of secure government accounts.",Security
"Botnet of 190,000 BadBox-Infected Android Devices Discovered",Society
"I tested the viral 'tangle-free' USB-C cable, and it's my new travel essential",Hardware
Intel ex-CEO Gelsinger and current co-CEO slapped with lawsuit over Intel Foundry disclosures — plaintiffs demand Gelsinger surrender salary earned,Business
Apple's 5G Expansion Plans,Hardware
Apple's next Giant Foldable iPad,Hardware
Ray-Ban Meta AI Upgrade,Artificial Intelligence
Digital twins of human organs are here. They’re set to transform medical treatment.,Biotechnology
Yulia Navalnaya urges Google to fight YouTube shutdown in Russia,Politics
The Next Great Leap in AI Is Behind Schedule and Crazy Expensive,Artificial Intelligence
Tennis organizations use artificial intelligence to identify cyberbullies,Society
Self-proclaimed Bitcoin inventor sentenced for contempt of court after launching $1.2 trillion lawsuit,Crypto
LockBit Ransomware Developer Arrested in Israel,Security
China's CXMT begins producing DDR5 memory — first China-made DDR5 sticks reportedly aimed at consumer PCs,Hardware
Lawmakers sound alarm over TSA facial recognition technology,Privacy
First demonstration of quantum teleportation over a fiber optic cable already carrying Internet traffic. Advance opens door for secure quantum applications without specialized infrastructure.,Networking/Telecom
Death Of A Forum: How The UK’s Online Safety Act Is Killing Communities,Net Neutrality
"Honda, Nissan to consider building vehicles at each other's plants",Transportation
Japan targets 40-50% power supply from renewables by 2040,Energy
"Worldcoin Must Delete All Iris Scanning Data From Users in Spain, Germany",Privacy
Google CEO Sundar Pichai says search giant has slashed manager roles by 10% in efficiency drive,Business
Tech antitrust is about to get really weird | President-elect Donald Trump’s second term is a regulatory wild card hanging over Big Tech,Business
Startup set to brick $800 kids robot is trying to open source it first | Most owners still won't be refunded for the emotional support toy.,Robotics/Automation
US judge finds Pegasus spyware maker liable over WhatsApp hack,Privacy
S. Korea to launch 3rd homegrown military spy satellite ,Space
U.S. finalizes US$4.7 bln in CHIPS Act subsidy to Samsung Electronics ,Business
5 actually good things that happened in technology this year,Society
"When the Feds Are Still Watching. Former Black Panthers fear the FBI is still keeping tabs on them decades after COINTELPRO. In at least one case, they were right.",Privacy
"The promise and warning of Truth Terminal, the AI bot that secured $50,000 in bitcoin from Marc Andreessen",Artificial Intelligence
New Anthropic study shows AI really doesn’t want to be forced to change its views,Artificial Intelligence
"Bluesky could become target of foreign disinformation, experts warn",Social Media
The Gov't Is Shutting Down Because Musk Has Factories In China,Politics
Pornhub to block access in Florida amid lawsuit over state’s age verification law,Politics
"Qualcomm processors properly licensed from Arm, US jury finds",Business
Misinformation in South Korea soars during and after martial law declaration ,Social Media
This waterproof case will keep an AirTag alive for a decade,Hardware
The European Pirate Party endorses the ‘Stop Destroying Videogames’ European Citizens’ Initiative as the first European political party to do so,Politics
"Plant-animal hybrid cells make solar-powered tissues, organs or meat",Biotechnology
Feds clear the way for robotaxis without steering wheels and pedals,Transportation
Sony says the GPU in the PS5 Pro is mostly very old tech but previews the ray-tracing upgrades from future RDNA 4 graphics for PCs | Backwards compatibility means PS5 Pro is mostly RDNA 2.,Hardware
"Rest assured that Qi2 does require magnets, WPC clarifies",Hardware
Three of the biggest US banks are facing a lawsuit for ‘widespread fraud’ on Zelle,Business
CFPB sues America's largest banks for 'allowing fraud to fester' on Zelle,Business
"US plans to blacklist company that ordered TSMC chip found in Huawei processor, source says",Hardware
"Packed Cubicles, Empty Corner Office: Remote Work Is Increasingly a Right of the Rich",Society
German watchdog orders Sam Altman’s biometric ID project World to delete data,Privacy
Hundreds of small websites may shut down due to UK's Online Safety Act,Net Neutrality
Ascension: Health data of 5.6 million stolen in ransomware attack,Security
Certain type of gaming provides “substantial benefits” to mental well-being,Society
Apple Complains Meta Requests Risk Privacy in Spat Over EU Efforts to Widen Access to IPhone Tech,Business
Rivian executives accused of harassment in previously unreported lawsuits,Business
VPN used for VR game cheat sells access to your home network,Privacy
"""Spotify and the ghost label""",Society
New Swiss Re study: Waymo is safer than even the most advanced human-driven vehicles,Transportation
Netflix will stream the Women’s World Cup in 2027 and 2031,Business
IBM's new enterprise AI models are more powerful than anything from OpenAI or Google,Artificial Intelligence
Automattic vs WP Engine: WordPress wars heat up,Software
Apple Teams Up With NVIDIA To Speed Up AI Language Models,Artificial Intelligence
"As firms abandon VMware, Broadcom is laughing all the way to the bank",Business
Humanoid robots being mass produced in China,Artificial Intelligence
EU Approves Nvidia's Acquisition Of Run:AI,Artificial Intelligence
Batman: Arkham Shadow Proves VR Gaming Isn't Just a Gimmick,Hardware
"US temporarily bans drones in parts of NJ, may use “deadly force” against aircraft",Hardware
European start-up Ōura valuation leaps to $5.2bn. The Finnish company’s growing popularity has led to its sales more than doubling this year,Society
Motorola phones could be banned in the US after judge issues ruling,Security
LG’s transparent TV costs more than a car,Hardware
Senators rip into automakers for selling customer data and blocking right to repair,Privacy
"Tesla recalls 700,000 vehicles over tire pressure warning failure",Transportation
TP-Link - Our Security Commitment,Security
"New physics sim trains robots 430,000 times faster than reality | ""Genesis"" can compress training times from decades into hours using 3D worlds conjured from text.",Artificial Intelligence
Only 15% of all Steam users' time was spent playing games released in 2024,Society
Google CEO Sundar Pichai updates on job cuts in town hall: 10% management roles cut and other changes,Business
Journalism group urges Apple to disable AI summaries after fake headline incident | Apple has yet to respond,Artificial Intelligence
Even Netflix struggles to identify and understand the cost of its AWS estate,Business
Google urges federal judge to toss data privacy suit by health care patients,Privacy
What happens when the internet disappears?,Artificial Intelligence
Mainland China autonomous vehicle development on a different track,Robotics/Automation
Is Matt Mullenweg the Mad King of WordPress?,Business
"Arizona School’s Curriculum Will Be Taught by AI, No Teachers",Artificial Intelligence
Baby Steps Toward 3D DRAM,Hardware
New Gmail Security Warning For 2.5 Billion—Second Attack Wave Incoming,ADBLOCK WARNING
Forget Chrome—Google Starts Tracking All Your Devices In 8 Weeks,ADBLOCK WARNING
"Every AI Copyright Lawsuit in the US, Visualized ",Artificial Intelligence
"Many Videos That Purport to Show Drones in New Jersey Likely Show Planes, Visual Analysis Finds",Transportation
China’s TCL overtakes Samsung in premium market for ultra-large TVs,Business
US mulls TP-Link routers ban on national security concerns,Security
"Sask. appeal court gives 2 thumbs up to decision that emoji is contractually binding | 1 appeal judge dissented, stating thumbs-up image did not meet signature requirements",Business
Trump is on collision course with EU over Big Tech crackdown,Politics
"TP-Link Routers Could Be Banned In the Next Year, Affecting Nearly 65% of Internet Users in the US",Politics
Hyundai Is Becoming the New Tesla,Transportation
Amazon to settle dispute with delivery drivers over claims worth potential £140m,Business
"Massive data breach at federal credit union exposes 240,000 members",Security
Cops bust picket line in New York as Teamsters strike at seven Amazon warehouses,Business
How to tell if a USB cable is hiding malicious hacker hardware,Hardware
Feds Warn SMS Authentication Is Unsafe After ‘Worst Hack in Our Nation’s History’,Security
Valve will be Lenovo’s ‘special guest’ at just-announced gaming handheld event,Business
"The FAA is banning drones in parts of NJ after thousands of mystery sightings | The temporary flight restriction covers 22 New Jersey towns, including Jersey City, Elizabeth, and Camden.",Society
AI learns to distinguish between aromas of US and Scottish whiskies,Artificial Intelligence
North Korea-linked hackers accounted for 61% of all crypto stolen in 2024,Crypto
Boeing Starliner astronauts stuck at International Space Station must delay return to Earth yet again,Space
"Samsung, Hyundai Motor eye tech alliance on autonomous vehicle chips - KED Global",Hardware
Amazon workers strike at seven US sites during year's busiest period,Business
Improved Meta Ray-Ban smart glasses could land in 2025 – with a much requested upgrade,Hardware
Google Street View Images Lead Police to a Murder Suspect. Pro tip: Make sure you don't load a body into a trunk when a Street View car is driving by.,Society
New York enacts laws curbing harmful social media algorithms for users under 18,Social Media
The delusion of Amazon Haul | Amazon’s new ultracheap discount store looks a lot like Temu. And Shein. And AliExpress.,Business
"New Research Shows AI Strategically Lying | The paper shows Anthropic’s model, Claude, strategically misleading its creators during the training process in order to avoid being modified.",Artificial Intelligence
Wind power generation hits second record in matter of days,Energy
US government urges high-ranking officials to lock down mobile devices following telecom breaches,Security
Microsoft really wants users to ditch passwords and switch to passkeys,Security
‘World’s first’ grid-scale nuclear fusion power plant announced in the US,Energy
Microsoft confirms ads for Call of Duty: Black Ops 6 in Windows 11 — here's how to turn them off,Software
DJI evades US block but has one year to prove its products aren't a national security threat | A clause in the $895 billion US Defense Bill starts a one-year countdown that would automatically ban its products.,Politics
Apple Reportedly Abandons Plan for iPhone-as-a-Subscription | The now-dead plan was for people to pay a monthly fee to get a new iPhone every year.,Business
Putin says Google is a tool used by the United States,Privacy
Teamsters union launches historic nationwide strike against Amazon,Business
Czech Government Approves National Climate and Energy Plan,Energy
"Apple pushes back on Meta's requests, cites alarming privacy concerns",Privacy
The Energy Giant Using Southern Yellow Pine to Power Data Centres,Artificial Intelligence
Malicious ads push Lumma infostealer via fake CAPTCHA pages,Security
"Sony is now FromSoftware owner Kadokawa's largest shareholder | Forming a ""strategic capital and business alliance"".",Business
Amazon’s RTO delays exemplify why workers get so mad about mandates | Amazon lacks space to accommodate its entire workforce.,Business
We May Be on the Brink of Finding the Real Planet Nine,Space
Steve Harvey Death Hoax: AI-Generated Article Allegedly to Blame,Artificial Intelligence
Chinese cybersecurity centre accuses US of hacking and stealing tech secrets,Security
Florida to lose PornHub access,Politics
"Apple in talks with Tencent, ByteDance to roll out AI features in China, sources say",Artificial Intelligence
US chemists debunk 100-year-old Bredt’s Rule to change organic chemistry forever,Nanotech/Materials
"Grubhub to pay $25 million for misleading customers, restaurants, drivers",Business
Microsoft Stops Updates For Millions Of Windows Users— It  breaks your games,ADBLOCK WARNING
"Google Street View Captures a Man Loading a Bag Into a Trunk. Arrests Follow.
",Privacy
"The two best-selling consoles in US history are officially both Nintendo, as the Switch bumps the PS2 down to third place | Nintendo's affordability strikes again",Hardware
An Android phone maker just topped Apple in wearables (and it's not Samsung),Hardware
The Edgelord AI That Turned a Shock Meme Into Millions in Crypto | Truth Terminal started as a techno-modernist art project meant to invite discussion about the applications and potential dangers of autonomous AI agents. Then it took on a life of its own.,Artificial Intelligence
"In display of fealty, tech industry curries favor with Trump — The $1 million donations came gradually, and then all at once. Meta. Amazon. OpenAI’s Sam Altman. Uber and its CEO.",Business
Harvard Is Releasing a Massive Free AI Training Dataset Funded by OpenAI and Microsoft,Artificial Intelligence
'FCC has no business threatening to take away broadcast licenses': Outgoing commissioner Jessica Rosenworcel,Networking/Telecom
New microscopy technique could enable rapid tumor analysis in the operating room,Biotechnology
"Balcony solar panels can save 30% on a typical household’s electricity bill and, with vertical surface area in cities larger than roof space, the appeal is clear",Energy
What WordPress users need to know about the Automattic and WP Engine conflict,Software
Tracker firm Hapn spilling names of thousands of GPS tracking customers,Privacy
EPA allows California to ban gas-powered new car sales by 2035,Transportation
Almost a million ConnectOnCall users may have had data stolen by hackers | Healthcare tech has suffered a huge breach,Security
"U.S. tech continues to power Russian weapons despite export controls, Senate Democrats find",Business
"‘The work damaged me’: ex-Facebook moderators describe effect of horrific content | Former workers at Samasource say violent, graphic and sexually explicit videos left them fearful to go outside",Social Media
"Microsoft Bought Nearly 500,000 Nvidia Hopper Chips This Year",Hardware
"US government tells officials, politicians to ditch regular calls and texts",Politics
"RealPage pricing software adds billions to rental costs, says White House — Renters in the U.S. spent an extra $3.8 billion last year allegedly due to landlords’ price coordination",Software
Who needs the dark web? Drug sales flourish on social media,Social Media
This TikTok account pumped out fake war footage with AI — until CBC News investigated,Society
"Flipboard launches Surf, a new app that YOU can't access 'cause you're not one of the cool kids.",Social Media
The Kids Online Safety Act’s last stand,Politics
"Trump to block the government and military from buying EVs | Trump's attack on clean vehicles to be bigger than thought, says report.",Transportation
Broward judge dons virtual reality headset in what’s thought to be a courtroom first,Politics
"Sam Altman-backed nuclear startup Oklo lands massive data center power deal, with caveats",Business
Cohere is quietly working with Palantir to deploy its AI models,Security
Supreme Court to hear challenge to banning TikTok in the United States,Social Media
What does Big Tech hope to gain from warming up to Trump?,Politics
US government set to approve spending $3 billion to remove Chinese telecoms equipment,Networking/Telecom
U.S. Supreme Court will hear arguments over TikTok divestment law,Social Media
