title,flair
"Are Those Drones Over New Jersey? Despite Sightings, U.S. Is Skeptical — Drones have been reported in at least 10 counties of the state. But a White House spokesman suggested many of them were actually manned aircraft.",Robotics/Automation
Google and Samsung VR and AR glasses announced ,Artificial Intelligence
Microsoft quietly axes Skype credit and phone number sales to push subscriptions,Software
ACLU condemns police use of AI to draft reports,Artificial Intelligence
Intel Arc B580 review: The new $249 GPU champion has arrived,Hardware
Sundar Pichai and Jeff Bezos head to Mar-a-Lago to schmooze with Trump,Politics
Reddit is removing links to Luigi Mangione's manifesto — The company says it’s enforcing a long-running policy,Social Media
Intel Executives Say A Manufacturing Spinoff Is Possible,Hardware
AI enters Congress: Sexually explicit deepfakes target women lawmakers,Artificial Intelligence
"TikTok's Price? A Record $300 Billion, One Analyst Says",Social Media
Harvard Makes 1 Million Books Available to Train AI Models,Artificial Intelligence
‘Unprecedented risk’ to life on Earth: Scientists call for halt on ‘mirror life’ microbe research | Science,Biotechnology
Jared Isaacman on U.S. space competitiveness: ‘We can’t be second’,Space
"Synthetic biology experts outline a path to engineering 'mirror life,' highlight grave risks, and urge it never be done",Biotechnology
Were your call records stolen? AT&amp;T and Verizon probably won’t tell you.,Privacy
WGA Calls on Studios to Take 'Immediate Legal Action' on AI Companies Using Subtitles to Train Their Models,Artificial Intelligence
FCC throws open 6 GHz band to unlicensed low-power gizmos,Networking/Telecom
"Microsoft Recall screenshots credit cards and Social Security numbers, even with the ""sensitive information"" filter enabled",Software
Klarna stopped all hiring a year ago to replace workers with AI,Artificial Intelligence
A controversial plan to refreeze the Arctic is seeing promising results. But scientists warn of big risks,Biotechnology
Misinformation spread differently than most content on Facebook during the 2020 election,Social Media
Epic’s dream is starting to come true — its store will be preinstalled on ‘millions’ of Android phones,Business
It sure looks like OpenAI trained Sora on game content — and legal experts say that could be a problem,Artificial Intelligence
"No, Microsoft Won’t Let You Install Windows 11 on Unsupported PCs",Business
Australia demands big social platforms pay local news publishers,Politics
Major Leak: Millions of Americans at Risk This Holiday Season,Security
"In an odd bit of propaganda, Belarus claims to have its own Starlink technology",Politics
"YouTube TV Price To Rise $10 A Month, Reaching $82.99",Business
NASA video shows its next Martian helicopter soaring over Mars,Space
Beware Job Offers Via Text as FTC Says 'Task Scams' Are Skyrocketing,Security
"Google Unveils Mixed-Reality Headset With Samsung, Taking on Apple and Meta",Hardware
Facebook's Global Ad Revenue Poised To Top $100B In 2024: Report ,Social Media
YouTube “Enhances” Comment Section With AI-Generated Nonsense,Social Media
"Google announces Android XR, a new OS for headsets and smart glasses",Software
You can now use AirTags to expedite a lost luggage reunion through United’s mobile app,Software
Mark Zuckerberg’s Meta Donates $1 Million to Trump’s Inaugural Fund (Wall Street Journal),Politics
Palmer Luckey’s defense tech company will make next-gen military aircraft with Archer | A hybrid vertical takeoff and landing aircraft,Business
"Hands on with Project Astra, Google's see-all assistant",Artificial Intelligence
Trump’s Pick for FTC Chair is Ready to Undo the Good Things From Lina Khan,Politics
"YouTube TV Hikes Price $10 to $82.99
",Business
Homeland Security shares new details of mysterious drone flights over New Jersey,Politics
BeReal accused of annoying users into sharing their data,Privacy
IBM Boasts Industry-Leading Photonics to Cut AI Training Speed,Hardware
Trump May Split Up America's Cyber Agencies,Politics
US solar industry downplays climate in strategy for Trump era,Energy
Microsoft gives Alt+Space shortcut over to Copilot,Hardware
Russia takes unusual route to hack Starlink-connected devices in Ukraine,Security
Report: Google told FTC Microsoft’s OpenAI deal is killing AI competition,Business
"US firm beats Microsoft, Harvard with 50 entangled logical qubits in quantum computer | Records are tumbling in months as companies race to build fault tolerant quantum computers.",Machine Learning
Nvidia Denies Rumors It Will Cut Supplies To China,Hardware
Conspiracy theories overwhelm Reserve Bank submissions,Society
"Firefox, one of the first “Do Not Track” supporters, no longer offers it",Privacy
Japanese publisher Kadokawa paid $3 million to Russia-linked hacker group after cyberattack,Business
"US to cap countries’ advanced chip access, with China in sights: sources",Politics
Greece to Introduce Social Media Restrictions for Young Users,Social Media
Google claims its new Willow quantum chip can swiftly solve a problem that would take a standard supercomputer 10 septillion years.,Hardware
"U.S. online gambling losses to surpass $1 trillion by 2028, group says ",Business
Mozilla removing Do Not Track option from Firefox 135,Security
"Pentagon says mystery drones over New Jersey are 'not US military,' not likely foreign | TechCrunch",Robotics/Automation
Crypto’s Legacy Is Finally Clear,Crypto
FBI says it has no answers for drones seen over New Jersey,Robotics/Automation
Encryption is non-negotiable: open letter to EU to not undermine privacy.,Security
"Apple reveals new AI chip building partner, and it isn't Amazon",Artificial Intelligence
Chatbot 'encouraged teen to kill parents over screen time limit',Artificial Intelligence
"Meta donates $1 million to Trump’s inaugural fund in latest step to mend relationship
",Social Media
"Meta, TikTok and Google to be forced to pay for Australian news",Social Media
Blocking Chinese spies from intercepting calls? Sen. Wyden blasts FCC's 'failure' amid Salt Typhoon hacks,Privacy
"Fujitsu flaunts massive 144-core Monaka Arm chip — 2nm and 5nm chiplets, 3D-stacked CPU cores over memory",Hardware
In GPU We Antitrust,Politics
Tech billionaires prepare to invade the Pentagon,Politics
World-1st tubular 'mini intestine' crafted by Japan researchers from human iPS cells  ,Biotechnology
"Mysterious SUV-sized drones may have blocked medical helicopter | Locals and police continue to report unidentified aerial vehicles across Pennsylvania, New Jersey, and New York.",Robotics/Automation
OnlyFans Models Are Using AI Impersonators to Keep Up With Their DMs,Artificial Intelligence
"Pentagon announces new AI office as it looks to deploy autonomous weapons
",Security
From X to Bluesky: why are people fleeing Elon Musk’s ‘digital town square’?,Social Media
Companies try to stop online support for CEO killer suspect,Social Media
"GM is giving up on Cruise robotaxis, pivots to personal autonomous vehicles",Transportation
Open source maintainers are drowning in junk bug reports written by AI,Artificial Intelligence
TCL TVs will use films made with generative AI to push targeted ads,Artificial Intelligence
Two Teens Indicted for Creating Hundreds of Deepfake Porn Images of Classmates,ADBLOCK WARNING
It sure looks like OpenAI trained Sora on game content — and legal experts say that could be a problem ,Artificial Intelligence
"Incoming FTC Chair: I will stop investigations that I falsely claim are politically motivated, and launch my own politically motivated investigations",Politics
"Microsoft now allows Windows 11 installations on unsupported hardware, devices.",Software
Supreme Court Dismisses NVIDIA’s Securities Fraud Appeal,Hardware
"LG stops making Blu-ray players, marking the end of an era — limited units remain while inventory lasts | Digital streaming is displacing the last remnants of physical media.",Hardware
72pc accounts spreading anti-Bangladesh misinformation located in India: Rumor Scanner ,Society
How the AI Boom Threatens to Short-Circuit Climate Action,Artificial Intelligence
"Facebook, Instagram, and Threads are down - The Verge",Social Media
Microsoft starts testing iPhone file sharing for Windows PCs,Business
"""Become Anyone 2.0"" is an LED display face-changing mask that lives up to its name.",Hardware
"With promising early data in triple negative breast cancer, a new bispecific heats up",Biotechnology
"Instagram, Facebook, WhatsApp, and Threads are currently down in major Meta outage",Social Media
"Watch Chinese security robot with wheels for feet scramble down hills and perform acrobatics - With wheels and a choice of two legs or four, the DEEP Robotics Lynx is capable of traversing tough terrain",Robotics/Automation
Designer Babies Are Teenagers Now—and Some of Them Need Therapy Because of It,Society
Hong Kong police consider using drones for patrols as rules are reviewed,Robotics/Automation
Google releases the first of its Gemini 2.0 AI models,Artificial Intelligence
Google unveils Project Mariner: AI agents to use the web for you | TechCrunch,Software
Microsoft gives Alt+Space shortcut over to Copilot,Software
"Intel Arc B580 Battlemage GPU OpenCL/Vulkan Performance Leaks Out, 9% To 30% Faster Than A580",Hardware
Steam has just beaten its concurrent players record once again with a whopping 39.2 million at one time | And there are a few big launches to thank.,Software
TikTok Offers Cash to Users to Recruit Friends Ahead of US Ban,Social Media
"Russia Tests Cutting Off Access to Global Web, and VPNs Can't Get Around It",Networking/Telecom
"QuantumScape Releases Next-Generation Solid-State Battery Separator Equipment, Cobra",Energy
The AI revolution is running out of data. What can researchers do?,Artificial Intelligence
Wyden proposes bill to secure US telecoms after Salt Typhoon hacks,Politics
LinkedIn wants to have its TikTok era,Social Media
The Operators Behind Four Major Neo-Nazi X Accounts,Society
"Amazon starts selling Hyundai cars, more brands next year | Amazon Autos has gone live in 48 US cities",Business
Russia teams up with BRICS to create AI alliance,Machine Learning
iPhone update brings controversial AI features that let you make pictures of friends,Artificial Intelligence
"Intel should have focused on AI rather than chipmaking, TSMC founder says ",Business
Krispy Kreme is latest to report a cyberattack that’s hampering its business,Security
YouTube Says Viewers Streamed Over 1 Billion Hours Daily From Their Living Rooms in 2024,Social Media
"Indian police demand Starlink reveal buyer of device found in $4.2 billion drug bust | Smugglers were caught with 13,227 pounds of meth",Society
"B.C. lawsuit claims Electronic Arts video game ""loot boxes"" are deceptive",Business
Popular Science declares Vision Pro to be gadget of the year,Hardware
"In a not-so-subtle signal to regulators, Blue Origin says New Glenn is ready",Space
"Spying on Student Devices, Schools Aim to Intercept Self-Harm Before It Happens
New technology alerts schools when students type words related to suicide.",Artificial Intelligence
WP Engine wins preliminary injunction in WordPress legal battle | The judgement temporarily forces Automattic to restore WPEngine's access to Wordpress.org.,Business
Apple launches its ChatGPT integration with Siri,Artificial Intelligence
Startup will brick $800 emotional support robot for kids without refunds | Embodied says it will try to refund recent purchases but makes no promises.,Business
Spotify's Car Thing Accessory is Officially Dead,Hardware
"PeerTube, the Open-Source YouTube, Now Has Mobile Apps",Software
YouTube can now automatically dub your videos,Social Media
Philippines constructing $3bn ‘world’s largest’ integrated solar/battery facility,Energy
"The blame game between governments, banks and tech companies over who foots the bill for cyber scams",Security
"China’s ‘explosive’ ironmaking breakthrough achieves 3,600-fold productivity boost",Nanotech/Materials
Google says its new quantum chip indicates that multiple universes exist,Hardware
Tesla lobbied UK to strengthen rules on carbon emissions from cars and lorries | Tesla,Business
"WordPress parent company must stop blocking WP Engine, judge rules",Business
"Google asks FTC to break up Microsoft's cloud deal with OpenAI, the Information says",Artificial Intelligence
Valve is now selling refurbished Steam Deck OLEDs starting at $439,Hardware
JR East to launch scan-free ticket gates for app users within 10 yrs,Transportation
A Bionic Leg Controlled by the Brain ,Hardware
Cruise employees ‘blindsided’ by GM’s plan to end robotaxi program,Business
Judge rejects sale of Alex Jones' Infowars to The Onion in dispute over bankruptcy auction,Business
Nvidia Is Now Too Powerful For Beijing To Constrain,Hardware
To Fab Or Not To Fab Is The $7B Question For Intel,Hardware
"It's not yet official, but this is the world's smallest arcade machine. Guess what game it plays?",Hardware
"Video is AI’s new frontier – and it is so persuasive, we should all be worried | I tried Sora, OpenAI’s new tool, and it just left me sad. Are we ready for a world in which we can never tell what is real?",Artificial Intelligence
Paul McCartney warns AI ‘could take over’ as UK debates copyright laws,Artificial Intelligence
What should we do if AI becomes conscious? These scientists say it’s time for a plan | Researchers call on technology companies to test their systems for consciousness and create AI welfare policies.,Artificial Intelligence
NASA says moon mission is further delayed but hopes to land astronauts before China,Space
G.M. Will Stop Developing Self-Driving Taxis,Transportation
Location data firm helps police find out when suspects visited their doctor,Privacy
"‘My name is Taqqiq, I can read text’: Microsoft Translator adds Inuktitut text-to-speech",Software
"Proposed merger of Kroger and Albertsons is halted by federal, state judges",Business
"WordPress must stop blocking WP Engine, judge rules",Business
Salt Typhoon recorded 'very senior' US officials' calls,Security
US military grounds entire Osprey tiltrotor fleet,Transportation
Telegram’s cyber attack against Ukraine has been hidden in plain sight,Society
Social Media Is a Growing Vehicle for Climate Misinformation.,Society
Suspect in CEO’s killing had discussed his health struggles on Reddit,Social Media
"Over $6 billion in CHIPS Act funding finalized for Micron plants in the US | The US Commerce Department says Micron’s Idaho and New York plants will create around 20,000 jobs.",Business
GM halts funding of robotaxi development by Cruise,Business
"Boeing cancels its workplace surveillance program, will be ‘removing the sensors that have been installed’ — less than a day after The Seattle Times requested comment about leaked information",Business
Astronomers discover one of the fastest-spinning stars in the universe,Space
ChatGPT caught lying to developers: New AI model tries to save itself from being replaced and shut down,Artificial Intelligence
Apple’s Next Ultra Smartwatch Will Be Able to Send Texts Via Satellite,Business
"Mozilla Firefox removes ""Do Not Track"" Feature support: Here's what it means for your Privacy",Privacy
FTC refunding $72 million to Fortnite players over ‘unwanted’ purchases | Players are getting money back for Fortnite skins that the FTC claims players were pressured into buying,Politics
"Just to cap off Intel's annus horribilis, Time picks AMD's Dr Lisa Su as its CEO of the year | Definitely a better choice than last year's pick, that's for sure.",Business
Open source maintainers are drowning in junk bug reports written by AI - Python security developer-in-residence decries use of bots that 'cannot understand code',Artificial Intelligence
Nvidia Forges Deals In American Southwest And Southeastern Asia,Hardware
Surrey announces world's first AI model for near-instant image creation on consumer-grade hardware,Artificial Intelligence
Trump's DOJ secretly obtained phone and text message logs of 43 congressional staffers and 2 members of Congress,Politics
Why Google's legal troubles could hasten Firefox's slide into irrelevance,Software
California Police Use AI to Transcribe Body Cam Videos,Artificial Intelligence
"Microsoft 365 outage takes down Office web apps, admin center",Software
Game publishers are refusing to commit to release dates for fear of clashing with GTA 6 | Probably a good idea,Business
Is this Switch 2? Accessory maker pulls trailer showing blurry mockup of Nintendo's next console design,Business
Reddit debuts AI-powered discussion search—but will users like it?,Social Media
Google claims quantum computing milestone — but the tech can't solve real-world problems yet,Hardware
Google invests in Intersect Power in over $800 million funding round amid AI race,Artificial Intelligence
"Chatbots urged teen to self-harm, suggested murdering parents, lawsuit says",Artificial Intelligence
"Rheinmetall, Auterion to Develop Standardized Software for Military Drones
",Security
Researchers design new shape-changing device for visually impaired,Biotechnology
Former Intel CEO Pat Gelsinger calls for prayer and fasting for employees,Hardware
A mischievous Yakuza / Like a Dragon fan has tricked Google Maps into including the video game series' iconic Millennium Tower Rooftop as a tourist attraction in its real world Tokyo map,Society
A phone company developed an AI 'granny' to beat scammers at their own game,Machine Learning
EU cybersecurity rules for smart devices enter into force ,Security
Microsoft Unveils Zero-Water Data Centers to Reduce AI Climate Impact,Society
"Apple hit with $1.2B lawsuit after killing controversial CSAM-detecting tool. Apple knowingly ignoring child porn is a ""never-ending nightmare,"" lawsuit says.",Business
Microsoft U-turns on Windows 11 TPM requirement days after doubling down,Security
"China’s ironmaking breakthrough achieves 3,600-fold productivity boost",Energy
Dodge maker Stellantis and China's CATL team up to build $4.3 billion EV battery plant in Spain,Business
US finalizes more than $6.1 billion chips subsidy for Micron Technology,Business
"Alarming amount of Texas Instrument chips found in Russian-based weapons in Ukraine — Russian military using third parties to purchase U.S-made chips | The U.S., and Texas Instruments, are struggling to crack down on slippery Russian-bound shipments.",Hardware
"SAP says GenAI will help solve legacy migration skills shortage - As 2027 support deadline looms, German vendor puts faith in on-trend tech to help SIs do more with less",Software
"How Russia-backed influencers meddled in Romania’s vote — Presidential election annulled after ‘illegal’ social media campaign deploys 100 paid influencers with 8 million followers on TikTok, Meta platforms",Social Media
Interview: Why diamonds may be a computer's best friend,Nanotech/Materials
China’s chip making shows progress with new EUV patent despite US sanctions,Politics
Nvidia shares slide after China launches probe of suspected anti-monopoly violations,Business
What is a ghost gun and are they legal? | Brian Thompson shooting,Security
"China targets Nvidia with antitrust probe, escalates US chip tensions ",Hardware
AI robot companions for kids go dark as company shutters.,Robotics/Automation
Google steps in after McDonald's gets ‘review bombed’ over arrest in UnitedHealth CEO's murder,Social Media
The Age of Chiplets is Upon Us - EE Times,Hardware
Why thermal batteries could replace lithium-ion batteries for energy storage,Energy
Nunavut creates Inuktitut text-to-speech model with Microsoft’s help,Software
"Israeli wave energy project draws interest from Qatar, Saudi Arabia and even Iran",Energy
"Cable ISPs compare data caps to food menus: Don’t make us offer unlimited soup | Data plans compared to a ""tasting menu, a buffet, or unlimited soup and salad.""",Networking/Telecom
X helps negotiate updated text for Kids Online Safety Act,Politics
Spotify has disabled Car Thing streaming devices,Software
Tesla sued by deceased driver’s family over 'fraudulent misrepresentation' of Autopilot safety,Robotics/Automation
Reddit tests a conversational AI search tool | TechCrunch,Social Media
It's time to rethink smartphone design,Nanotech/Materials
Quantum Computers Cross Critical Error Threshold | Quanta Magazine,Hardware
Reddit introduces AI-powered 'Reddit Answers' search feature,Social Media
3D-printed ‘ghost gun’ discovered on suspect in connection to Brian Thompson assassination,Society
Ransomware attack hits leading heart surgery device maker,Security
AI slop is already invading Oregon’s local journalism,Artificial Intelligence
Google unveils 'mind-boggling' quantum computing chip,Hardware
How Chinese insiders are stealing data scooped up by President Xi's national surveillance system,Privacy
"Meta launches open source Llama 3.3, shrinking powerful bigger model into smaller size",Artificial Intelligence
"As TikTok files emergency motion to stop US ban, brands &amp; creators are eyeing the door — Instagram Reels and YouTube Shorts poise to capitalise on migration",Business
Linux Preps For Kunpeng ARM Server SoC With High Bandwidth Memory,Hardware
FTC distributes $72M to Fortnite customers tricked into making unwanted purchases ,Business
"New KOSA, Same As Old KOSA, But Now With Elon’s Ignorant Endorsement",Politics
Google unveils ‘mindboggling’ quantum computing chip,Hardware
"Microsoft now allowing Windows 11 on older, incompatible PCs",Hardware
Google’s quantum chip solves ‘impossible’ problems in five minutes,Hardware
A Software Engineer is Mapping License Plate Readers Nationwide: ‘I don’t like being tracked’,Privacy
Oceanographers record the largest predation event ever observed in the ocean,Biotechnology
TikTok files emergency injunction in latest bid to stall US ban,Social Media
Google says its new quantum chip is way faster than the world's most powerful supercomputer,Hardware
Largest AI data centre in the world to be built in northwest Alberta,Artificial Intelligence
"Marco Grossi, the man behind the success of iLovePDF | The company that cuts, pastes, compresses and solves everything in the universe of this document format was the brainchild of a design student from Barcelona. Today it employs 43 people and its website is one of the 50 most visited in the world",Business
OpenAI's Sora video generation AI model arrives globally later today,Artificial Intelligence
China opens an antitrust investigation into Nvidia - The Verge,Business
AI Will Turn Our Lives into The Truman Show,Artificial Intelligence
"The creator of ChatGPT's voice wants to build the tech from 'Her,' minus the dystopia",Artificial Intelligence
‘A truly remarkable breakthrough’: Google’s new quantum chip achieves accuracy milestone,Hardware
"Sick Americans say they’re turning to TikTok’s creator rewards program to crowdfund medical bills - As public outrage grows over the U.S. healthcare system, some social media creators say they’re using TikTok payouts of $1 per 1,000 views to raise money for treatment costs.",Social Media
"Mercedes is working on ""solar paint"" that could drastically reduce the need for charging",Transportation
Google says it has cracked a quantum computing challenge with new chip,Hardware
TikTok asks court to pause law that could shut down app in U.S. next month,Social Media
Nvidia stock tumbles on news of China investigation: Is the AI chip giant in trouble?,Hardware
Nvidia Facing China Antitrust Investigation,Politics
Latest James Webb data hints at new physics in Universe’s expansion | These latest findings further support the Hubble Space Telescope's prior expansion rate measurements.,Space
Ukraine Weighs Telegram Security Risks Amid War With Russia,Society
NATO plans to deploy sea drones to monitor and protect undersea cables — Admiral expects drone fleet patrols to begin from June 2025 ,Robotics/Automation
Apple’s iPhone Hit By FBI Warning And Lawsuit Before iOS 18.2 Release,ADBLOCK WARNING
Reddit begins testing AI-powered answers feature to win more users,Artificial Intelligence
Russia’s Military Found A Surprisingly Simple Way To Buy US Chips,Hardware
"Scientists discover new way to make fuel from water and sunlight, but more work is needed",Energy
Biden Launched A US Chipmaking Boom. The Jobs Boost Will Come Under Trump.,Politics
"We can't make this stuff up: tech companies Palantir and Anduril form fellowship for AI adventures - Meanwhile, Sauron secures funding. Really.",Business
Covert Facebook Network Found to Be Targeting Romanian Voters,Social Media
Chinese Carmakers Are Taking Mexico by Storm While Eyeing U.S.,Transportation
How Peter Thiel’s network of right-wing techies is infiltrating Donald Trump’s White House,Politics
China Targets Nvidia For Potential Breaches of Anti-Monopoly Law ,Business
Covert Facebook Network Found to Be Targeting Romanian Voters,Society
US says Chinese hackers are still lurking in American phone networks,Security
Diamonds can now be created from scratch in the lab in 15 minutes,Nanotech/Materials
Google CEO: AI development is finally slowing down—‘the low-hanging fruit is gone’,Artificial Intelligence
Apple sued for failing to implement tools that would detect CSAM in iCloud,Business
Kyndryl's consulting business may be less than it seems,Business
"Badass Russian techie outsmarts FSB, flees Putinland all while being tracked with spyware",Privacy
UCLA offers comp lit course developed by AI ,Artificial Intelligence
